{
  "id": "era5-offline-check",
  "mode": "era5-offline",
  "name": "ERA5 Offline Validation",
  "period": {
    "start": "2026-01-01T00:00:00Z",
    "end": "2026-01-02T00:00:00Z"
  },
  "domain": {
    "label": "europe",
    "center_lat": 50.0,
    "center_lon": 10.0,
    "dx_km": 9,
    "dy_km": 9,
    "e_we": 50,
    "e_sn": 50
  },
  "inputs": {
    "source": "era5"
  },
  "outputs": {
    "directory": "workbench-runs/era5-offline-check"
  }
}
