{
  "id": "wrf-smoke-test",
  "mode": "wrf-smoke",
  "name": "WRF Idealized Smoke Test",
  "period": {
    "start": "2000-01-01T00:00:00Z",
    "end": "2000-01-01T01:00:00Z"
  },
  "domain": {
    "label": "idealized",
    "center_lat": 0.0,
    "center_lon": 0.0,
    "dx_km": 10,
    "dy_km": 10,
    "e_we": 74,
    "e_sn": 74
  },
  "inputs": {
    "source": "none"
  },
  "outputs": {
    "directory": "workbench-runs/wrf-smoke-test"
  }
}
