{
  "id": "kyrill-dry-run",
  "mode": "dry-run",
  "name": "Storm Kyrill Demo",
  "period": {
    "start": "2007-01-18T00:00:00Z",
    "end": "2007-01-19T00:00:00Z"
  },
  "domain": {
    "label": "central-europe",
    "center_lat": 51.0,
    "center_lon": 10.0,
    "dx_km": 9,
    "dy_km": 9,
    "e_we": 60,
    "e_sn": 60
  },
  "inputs": {
    "source": "era5"
  },
  "outputs": {
    "directory": "workbench-runs/kyrill-dry-run"
  }
}
